{
  "query": "formula 1 2025 driver standings",
  "timestamp": "2025-05-12T08:16:05.173796",
  "url_text": "F1 standings 2025: Updated driver and constructor points, results for new Formula One season | Sporting News\nSkip to main content\nShop\nTickets\nUnited States [English]\nEditions\nUnited States [English]\nArgentina\nAustralia\nBrasil\nCanada\nIndia\n日本\nMéxico\n대한민국\nEspaña\nไทย\nUnited Kingdom\nUnited States [Español]\nViệt Nam\nNFL\nNFL\nHome\nNews\nTeams\nScores\nSchedule\nStandings\nNFL Teams\nAFC East\nBuffalo Bills\nMiami Dolphins\nNew England Patriots\nNew York Jets\nAFC North\nBaltimore Ravens\nCincinnati Bengals\nCleveland Browns\nPittsburgh Steelers\nAFC South\nHouston Texans\nIndianapolis Colts\nJacksonville Jaguars\nTennesse Titans\nAFC West\nDenver Broncos\nKansas City Chiefs\nLas Vegas Raiders\nLos Angeles Chargers\nNFC East\nDallas Cowboys\nNew York Giants\nPhiladelphia Eagles\nWashington Commanders\nNFC North\nChicago Bears\nDetroit Lions\nGreen Bay Packers\nMinnesota Vikings\nNFC South\nAtlanta Falcons\nCarolina Panthers\nNew Orleans Saints\nTampa Bay Buccaneers\nNFC West\nArizona Cardinals\nLos Angeles Rams\nSan Francisco 49ers\nSeattle Seahawks\nNBA\nNBA\nHome\nNews\nTeams\nPlayoffs\nScores\nSchedule\nStandings\nNBA Teams\nAtlantic\nBoston Celtics\nBrooklyn Nets\nNew York Knicks\nPhiladelphia 76ers\nToronto Raptors\nCentral\nChicago Bulls\nCleveland Cavaliers\nDetroit Pistons\nIndiana Pacers\nMilwaukee Bucks\nSoutheast\nAtlanta Hawks\nCharlotte Hornets\nMiami Heat\nOrlando Magic\nWashington Wizards\nNorthwest\nDenver Nuggets\nMinnesota Timberwolves\nOklahoma City Thunder\nPortland Trail Blazers\nUtah Jazz\nPacific\nGolden State Warriors\nLA Clippers\nLos Angeles Lakers\nPhoenix Suns\nSacramento Kings\nSouthwest\nDallas Mavericks\nHouston Rockets\nMemphis Grizzlies\nNew Orleans Pelicans\nSan Antonio Spurs\nMLB\nMLB\nHome\nNews\nTeams\nScores\nSchedule\nStandings\nTransactions\nMLB Teams\nAL East\nBaltimore Orioles\nBoston Red Sox\nNew York Yankees\nTampa Bay Rays\nToronto Blue Jays\nAL Central\nChicago White Sox\nCleveland Guardians\nDetroit Tigers\nKansas City Royals\nMinnesota Twins\nAL West\nAthletics\nHouston Astros\nLos Angeles Angels\nSeattle Mariners\nTexas Rangers\nNL East\nAtlanta Braves\nMiami Marlins\nNew York Mets\nPhiladelphia Phillies\nWashington Nationals\nNL Central\nChicago Cubs\nCincinnati Reds\nMilwaukee Brewers\nPittsburgh Pirates\nSt. Louis Cardinals\nNL West\nArizona Diamondbacks\nColorado Rockies\nLos Angeles Dodgers\nSan Diego Padres\nSan Francisco Giants\nNHL\nNHL\nHome\nNews\nPlayoffs\nScores\nSchedule\nStandings\nF1\nF1\nHome\nNews\nTeams\nSchedule\nStandings\nEXPLORE F1\nTEAMS\nAlpine\nAston Martin\nFerrari\nHaas\nKick Sauber\nMcLaren\nMercedes\nRacing Bulls\nRed Bull Racing\nWilliams\n•••\nExplore More\nSoccer\nWNBA\nNCAAF\nNCAAMB\nNCAAWB\nBoxing\nMMA\nWWE\nNASCAR\nGolf\nTennis\nCollege\nHigh School\nDarts\nHorse Racing\nMore Sports\nFantasy\nBetting\nBetting\nSee More\nExplore Betting\nHome\nHow We Produce Content\nHow to Bet\nNFL\nNBA\nMLB\nNHL\nSoccer\nCollege Football\nCollege Basketball\nGolf\nUFC\nWatch\nWatch\nHow to Watch\nStreaming Services\nfubo\nSling\nParamount+\nPeacock\nESPN+\nApple TV\nDAZN\nBest Streaming Services\nBest VPN Services\nListen\nSiriusXM\nLifestyle\nLifestyle\nSee More\nThe Scene\nEntertainment\nFashion\nMoney\nRelationships\nSneakers\nTrending\nEssentials\nTickets\nStadium Guides\nF1\nNews\nTeams\nSchedule\nStandings\n•••\nNews\nTeams\nSchedule\nStandings\nFeatured\nNFL\nNBA\nMLB\nNHL\nSports\nNFL\nNBA\nMLB\nNHL\nSoccer\nNCAAF\nNCAAMB\nNCAAWB\nWNBA\nBoxing\nMMA\nWWE\nF1\nNASCAR\nGolf\nTennis\nCollege\nHigh School\nDarts\nHorse Racing\nMore Sports\nExplore More\nFantasy\nBetting\nWatch\nThe Scene\nTickets\nStadium Guides\nEditions\nUnited States [English]\nArgentina\nAustralia\nBrasil\nCanada\nIndia\n日本\nMéxico\n대한민국\nEspaña\nไทย\nUnited Kingdom\nUnited States [Español]\nViệt Nam\nAbout Us\nCareers\nPrivacy Policy\nPrivacy Preferences\nF1 standings 2025: Updated driver and constructor points, results for new Formula One season\nJoshua Mayne\n•\n•\nAfter a fast-paced start to the season across three continents,\nFormula 1\nwill now head to its spiritual home – Europe.\nLando Norris made the\nperfect start to his title challenge in Australia\nas he looks to dethrone reigning champion Max Verstappen.\nThe first sprint weekend of the 2025 campaign followed, with Lewis Hamilton recording his maiden win with Ferrari in the condensed race in China. However, it was McLaren who cleaned up in the Grand Prix race, with Oscar Piastri taking the chocolates ahead of Norris.\nVerstappen got on the board in the third race in Japan as he continued his dominance at Suzuka to edge the McLaren duo.\nHowever, Piastri hit back in impressive fashion, earning three consecutive wins in Bahrain, Saudi Arabia and Miami.\nBelow,\nThe Sporting News\nwill keep you updated with the drivers' and constructors' championship standings throughout 2025.\nMORE:\nF1 2025 - How long is every driver contracted for?\nF1 Drivers' World Championship 2025 standings, points\nPosition\nDriver\nTeam\nPoints\n1.\nOscar Piastri\nMcLaren\n131\n2.\nLando Norris\nMcLaren\n115\n3.\nMax Verstappen\nRed Bull\n99\n4.\nGeorge Russell\nMercedes\n93\n5.\nCharles Leclerc\nFerrari\n53\n6.\nKimi Antonelli\nMercedes\n48\n7.\nLewis Hamilton\nFerrari\n41\n8.\nAlexander Albon\nWilliams\n30\n9.\nEsteban Ocon\nHaas\n14\n10.\nLance Stroll\nAston Martin\n14\n11.\nYuki Tsunoda\nRed Bull\n9\n12.\nPierre Gasly\nAlpine\n7\n13.\nCarlos Sainz\nWilliams\n7\n14.\nNico Hulkenberg\nSauber\n6\n15.\nOliver Bearman\nHaas\n6\n16.\nIsack Hadjar\nRacing Bulls\n5\n17.\nFernando Alonso\nAston Martin\n0\n18.\nLiam Lawson\nRacing Bulls\n0\n19.\nJack Doohan\nAlpine\n0\n20.\nGabriel Bortoleto\nSauber\n0\nF1 Constructors' Championship 2025 standings, points\nPosition\nTeam\nPoints\n1.\nMcLaren\n246\n2.\nMercedes\n141\n3.\nRed Bull\n105\n4.\nFerrari\n94\n5.\nWilliams\n37\n6.\nHaas\n20\n7.\nAston Martin\n14\n8.\nRacing Bulls\n8\n9.\nAlpine\n7\n10.\nSauber\n6\nF1 2025 schedule, calendar\nDate\nGrand Prix\nTrack\nMar. 14-16\nAustralia\nMelbourne Grand Prix Circuit\nMar. 21-23\nChina*\nShanghai International Circuit\nApr. 4-6\nJapan\nSuzuka International Racing Course\nApr. 11-13\nBahrain\nBahrain International Circuit\nApr. 18-20\nSaudi Arabia\nJeddah Corniche Circuit\nMay 2-4\nMiami*\nMiami International Autodrome\nMay 16-18\nEmilia Romagna\nAutodromo Enzo e Dino Ferrari\nMay 23-25\nMonaco\nCircuit de Monaco\nMay 30-Jun.1\nSpain\nCircuit de Barcelona-Catalunya\nJun. 13-15\nCanada\nCircuit Gilles-Villeneuve\nJun. 27-29\nAustria\nRed Bull Ring\nJul. 4-6\nUnited Kingdom\nSilverstone Circuit\nJul. 25-27\nBelgium*\nCircuit de Spa-Francorchamps\nAug. 1-3\nHungary\nHungaroring\nAug. 29-31\nNetherlands\nCircuit Zandvoort\nSep. 5-7\nItaly\nAutodromo Nazionale Monza\nSep. 19-21\nAzerbaijan\nBaku City Circuit\nOct. 3-5\nSingapore\nMarina Bay Street Circuit\nOct. 17-19\nUSA*\nCircuit of the Americas\nOct. 24-26\nMexico\nAutodromo Hermanos Rodríguez\nNov. 7-9\nBrazil*\nAutodromo Jose Carlos Pace\nNov. 20-22\nLas Vegas\nLas Vegas Strip Circuit\nNov. 28-30\nQatar*\nLusail International Circuit\nDec. 5-7\nAbu Dhabi\nYas Marina Circuit\n*Sprint format\nF1 2025 results, podiums\nAustralian Grand Prix:\n1st: Norris, 2nd: Verstappen, 3rd: Russell\nChinese Grand Prix:\n1st: Piastri, 2nd: Norris, 3rd: Russell\nJapanese Grand Prix:\n1st: Verstappen, 2nd: Norris, 3rd: Piastri\nBahrain Grand Prix\n: 1st: Piastri, 2nd: Russell, 3rd: Norris\nSaudi Arabian Grand Prix\n: 1st: Piastri, 2nd: Verstappen, 3rd: Leclerc\nMiami Grand Prix:\n1st: Piastri, 2nd: Norris, 3rd: Russell\nJoshua Mayne\nJoshua Mayne is a content producer for The Sporting News currently based in Sydney, Australia. He has previously worked as a newsreader at 2SER and a journalist at Ministry of Sport. Joshua specialises in rugby league, motorsport and tennis. He is still waiting for Arsenal to win the Premier League again.\nCrafted for fans since 1886\nCompany\nAbout Us\nCareers\nPrivacy Policy\nPrivacy Preferences\nSporting News\nNFL Teams\nNBA Teams\nMLB Teams\nSoccer Teams\nWNBA Teams\nF1 Teams\nCopyright @ 2025 Sporting News Holdings\nImages by Getty Images, Imagn and AP Images. All Rights Reserved.",
  "url_tables": [
    {
      "Position": {
        "0": "1.",
        "1": "2.",
        "2": "3.",
        "3": "4.",
        "4": "5.",
        "5": "6.",
        "6": "7.",
        "7": "8.",
        "8": "9.",
        "9": "10.",
        "10": "11.",
        "11": "12.",
        "12": "13.",
        "13": "14.",
        "14": "15.",
        "15": "16.",
        "16": "17.",
        "17": "18.",
        "18": "19.",
        "19": "20."
      },
      "Driver": {
        "0": "Oscar Piastri",
        "1": "Lando Norris",
        "2": "Max Verstappen",
        "3": "George Russell",
        "4": "Charles Leclerc",
        "5": "Kimi Antonelli",
        "6": "Lewis Hamilton",
        "7": "Alexander Albon",
        "8": "Esteban Ocon",
        "9": "Lance Stroll",
        "10": "Yuki Tsunoda",
        "11": "Pierre Gasly",
        "12": "Carlos Sainz",
        "13": "Nico Hulkenberg",
        "14": "Oliver Bearman",
        "15": "Isack Hadjar",
        "16": "Fernando Alonso",
        "17": "Liam Lawson",
        "18": "Jack Doohan",
        "19": "Gabriel Bortoleto"
      },
      "Team": {
        "0": "McLaren",
        "1": "McLaren",
        "2": "Red Bull",
        "3": "Mercedes",
        "4": "Ferrari",
        "5": "Mercedes",
        "6": "Ferrari",
        "7": "Williams",
        "8": "Haas",
        "9": "Aston Martin",
        "10": "Red Bull",
        "11": "Alpine",
        "12": "Williams",
        "13": "Sauber",
        "14": "Haas",
        "15": "Racing Bulls",
        "16": "Aston Martin",
        "17": "Racing Bulls",
        "18": "Alpine",
        "19": "Sauber"
      },
      "Points": {
        "0": "131",
        "1": "115",
        "2": "99",
        "3": "93",
        "4": "53",
        "5": "48",
        "6": "41",
        "7": "30",
        "8": "14",
        "9": "14",
        "10": "9",
        "11": "7",
        "12": "7",
        "13": "6",
        "14": "6",
        "15": "5",
        "16": "0",
        "17": "0",
        "18": "0",
        "19": "0"
      }
    },
    {
      "Position": {
        "0": "1.",
        "1": "2.",
        "2": "3.",
        "3": "4.",
        "4": "5.",
        "5": "6.",
        "6": "7.",
        "7": "8.",
        "8": "9.",
        "9": "10."
      },
      "Team": {
        "0": "McLaren",
        "1": "Mercedes",
        "2": "Red Bull",
        "3": "Ferrari",
        "4": "Williams",
        "5": "Haas",
        "6": "Aston Martin",
        "7": "Racing Bulls",
        "8": "Alpine",
        "9": "Sauber"
      },
      "Points": {
        "0": "246",
        "1": "141",
        "2": "105",
        "3": "94",
        "4": "37",
        "5": "20",
        "6": "14",
        "7": "8",
        "8": "7",
        "9": "6"
      }
    },
    {
      "Date": {
        "0": "Mar. 14-16",
        "1": "Mar. 21-23",
        "2": "Apr. 4-6",
        "3": "Apr. 11-13",
        "4": "Apr. 18-20",
        "5": "May 2-4",
        "6": "May 16-18",
        "7": "May 23-25",
        "8": "May 30-Jun.1",
        "9": "Jun. 13-15",
        "10": "Jun. 27-29",
        "11": "Jul. 4-6",
        "12": "Jul. 25-27",
        "13": "Aug. 1-3",
        "14": "Aug. 29-31",
        "15": "Sep. 5-7",
        "16": "Sep. 19-21",
        "17": "Oct. 3-5",
        "18": "Oct. 17-19",
        "19": "Oct. 24-26",
        "20": "Nov. 7-9",
        "21": "Nov. 20-22",
        "22": "Nov. 28-30",
        "23": "Dec. 5-7"
      },
      "Grand Prix": {
        "0": "Australia",
        "1": "China*",
        "2": "Japan",
        "3": "Bahrain",
        "4": "Saudi Arabia",
        "5": "Miami*",
        "6": "Emilia Romagna",
        "7": "Monaco",
        "8": "Spain",
        "9": "Canada",
        "10": "Austria",
        "11": "United Kingdom",
        "12": "Belgium*",
        "13": "Hungary",
        "14": "Netherlands",
        "15": "Italy",
        "16": "Azerbaijan",
        "17": "Singapore",
        "18": "USA*",
        "19": "Mexico",
        "20": "Brazil*",
        "21": "Las Vegas",
        "22": "Qatar*",
        "23": "Abu Dhabi"
      },
      "Track": {
        "0": "Melbourne Grand Prix Circuit",
        "1": "Shanghai International Circuit",
        "2": "Suzuka International Racing Course",
        "3": "Bahrain International Circuit",
        "4": "Jeddah Corniche Circuit",
        "5": "Miami International Autodrome",
        "6": "Autodromo Enzo e Dino Ferrari",
        "7": "Circuit de Monaco",
        "8": "Circuit de Barcelona-Catalunya",
        "9": "Circuit Gilles-Villeneuve",
        "10": "Red Bull Ring",
        "11": "Silverstone Circuit",
        "12": "Circuit de Spa-Francorchamps",
        "13": "Hungaroring",
        "14": "Circuit Zandvoort",
        "15": "Autodromo Nazionale Monza",
        "16": "Baku City Circuit",
        "17": "Marina Bay Street Circuit",
        "18": "Circuit of the Americas",
        "19": "Autodromo Hermanos Rodríguez",
        "20": "Autodromo Jose Carlos Pace",
        "21": "Las Vegas Strip Circuit",
        "22": "Lusail International Circuit",
        "23": "Yas Marina Circuit"
      }
    }
  ]
}